{
  "id": "clash-damage",
  "params": [
    { "name": "power", "kind": "int" }
  ],
  "provides": [],
  "consumes": ["clash"],
  "contributes": [
    {
      "kind": "outcome",
      "key": "clash",
      "branch": "connect",
      "effects": [
        { "resource_change": { "resource": "focus", "delta_expr": "0 - (@caster.vigor + {power})" } }
      ]
    }
  ]
}
